{
  "schema_name": "analysis-result",
  "schema_version": "0.2.0",
  "analysis_result_id": "analysisresult_0195395c-7c9e-749a-8eb5-7b9c1d3e5f67",
  "created_at": "2026-08-09T12:06:00Z",
  "provenance": {
    "input_datasets": [
      {
        "dataset_id": "dataset_0195395c-7c9e-7389-bda4-6a8b0c2d4e56",
        "content_digest": "cccccccccccccccccccccccccccccccccccccccccccccccccccccccccccccccc"
      }
    ],
    "analysis_definition_id": "analysisdef_0195395c-7c9e-74ab-9fc6-8c0d2e4f6a78",
    "analysis_version": "summary-1",
    "analysis_parameters": {
      "schema_ref": "urn:ea-research-lab:schema:execution-summary-analysis-parameters:0.1.0",
      "value": {
        "schema_name": "execution-summary-analysis-parameters",
        "schema_version": "0.1.0"
      }
    },
    "computation_environment_id": "envcfg_0195395c-7c9e-7e45-8a6f-1b3c5d7e9f01"
  },
  "result_schema": "urn:ea-research-lab:schema:execution-summary-analysis-result:0.1.0",
  "result_digest": "1dc8bc9afca8508b4a3139e2f6ab329129da04ffc1acb7f5d221dd60c1c572b8",
  "result": {
    "schema_name": "execution-summary-analysis-result",
    "schema_version": "0.1.0",
    "baseline_content_digest": null,
    "metrics": [
      {
        "dataset_content_digest": "cccccccccccccccccccccccccccccccccccccccccccccccccccccccccccccccc",
        "currency": "USD",
        "net_return": {"value": "0.100000000000"},
        "win_rate": {"value": "0.600000000000"},
        "loss_rate": {"value": "0.400000000000"}
      }
    ],
    "comparisons": []
  }
}
